tweet_id,timestamp,source,text,expanded_urls,rating_numerator,rating_denominator,name,type,img_num,p1,p1_conf,p1_dog,retweet_count,favorite_count
683142553609318400,2016-01-02 04:27:31 +0000,"<a href=""http://twitter.com/download/iphone"" rel=""nofollow"">Twitter for iPhone</a>",Meet Brandy. She's a member of the Bloods. Menacing criminal pupper. Soft spot for flowers tho. 9/10 pet w caution https://t.co/hhIA3coiAJ,https://twitter.com/dog_rates/status/683142553609318400/photo/1,9,10,Brandy,pupper,1.0,Leonberg,0.605851,True,1173.0,3162.0
683111407806746624,2016-01-02 02:23:45 +0000,"<a href=""http://twitter.com/download/iphone"" rel=""nofollow"">Twitter for iPhone</a>",This is Larry. He thought the New Year's parties were tonight. 10/10 poor pupper. Maybe next year https://t.co/h3X0jK8MVM,https://twitter.com/dog_rates/status/683111407806746624/photo/1,10,10,Larry,pupper,1.0,Cocker_Spaniel,0.901392,True,1034.0,3736.0
683098815881154561,2016-01-02 01:33:43 +0000,"<a href=""http://twitter.com/download/iphone"" rel=""nofollow"">Twitter for iPhone</a>",aahhhhkslaldhwnxmzbbs 12/10 for being da smooshiest https://t.co/UOPdXmUz4H,https://twitter.com/dog_rates/status/683098815881154561/photo/1,12,10,None,Other,1.0,Golden_Retriever,0.889848,True,736.0,2361.0
683030066213818368,2016-01-01 21:00:32 +0000,"<a href=""http://twitter.com/download/iphone"" rel=""nofollow"">Twitter for iPhone</a>",This is Lulu. She's contemplating all her unreached 2015 goals and daydreaming of a more efficient tomorrow. 10/10 https://t.co/h3ScYuz77J,https://twitter.com/dog_rates/status/683030066213818368/photo/1,10,10,Lulu,Other,1.0,Boxer,0.722218,True,832.0,2370.0
682750546109968385,2016-01-01 02:29:49 +0000,"<a href=""http://twitter.com/download/iphone"" rel=""nofollow"">Twitter for iPhone</a>",Meet Taco. He's a speckled Garnier Fructis. Loves to shadow box. Ears out of control. Friend clearly impressed 9/10 https://t.co/85X1GHohFr,https://twitter.com/dog_rates/status/682750546109968385/photo/1,9,10,Taco,Other,1.0,English_Setter,0.947198,True,494.0,1674.0
682429480204398592,2015-12-31 05:14:01 +0000,"<a href=""http://twitter.com/download/iphone"" rel=""nofollow"">Twitter for iPhone</a>","I know we joke around on here, but this is getting really frustrating. We rate dogs. Not T-Rex. Thank you... 8/10 https://t.co/5aFw7SWyxU",https://twitter.com/dog_rates/status/682429480204398592/photo/1,8,10,None,Other,1.0,Whippet,0.594701,True,1320.0,3769.0
682406705142087680,2015-12-31 03:43:31 +0000,"<a href=""http://twitter.com/download/iphone"" rel=""nofollow"">Twitter for iPhone</a>",This is Patrick. He's a bigass pupper. 7/10 https://t.co/J9DXBFoAQe,https://twitter.com/dog_rates/status/682406705142087680/photo/1,7,10,Patrick,pupper,1.0,Wombat,0.709344,False,2019.0,8319.0
682393905736888321,2015-12-31 02:52:40 +0000,"<a href=""http://twitter.com/download/iphone"" rel=""nofollow"">Twitter for iPhone</a>",This is Kreg. He's riding an invisible jet ski. 11/10 that's downright legendary https://t.co/BA5AV5dx6Y,https://twitter.com/dog_rates/status/682393905736888321/photo/1,11,10,Kreg,Other,1.0,Vizsla,0.657275,True,773.0,2441.0
682303737705140231,2015-12-30 20:54:22 +0000,"<a href=""http://twitter.com/download/iphone"" rel=""nofollow"">Twitter for iPhone</a>",This is Todo. He's screaming because he doesn't want to wear his sweater or a seat belt. 9/10 gotta buckle up pup https://t.co/Nm8Spw4HbD,https://twitter.com/dog_rates/status/682303737705140231/photo/1,9,10,Todo,Other,1.0,Seat_Belt,0.997659,False,1135.0,3389.0
682242692827447297,2015-12-30 16:51:48 +0000,"<a href=""http://twitter.com/download/iphone"" rel=""nofollow"">Twitter for iPhone</a>",This is Samson. He patrols his waters on the back of his massive shielded battle dog. 11/10 https://t.co/f8dVgDYDFf,https://twitter.com/dog_rates/status/682242692827447297/photo/1,11,10,Samson,Other,1.0,Snorkel,0.504983,False,1341.0,3566.0
682059653698686977,2015-12-30 04:44:28 +0000,"<a href=""http://twitter.com/download/iphone"" rel=""nofollow"">Twitter for iPhone</a>",This is Tess. Her main passions are shelves and baking too many cookies. 11/10 https://t.co/IriJlVZ6m4,"https://twitter.com/dog_rates/status/682059653698686977/photo/1,https://twitter.com/dog_rates/status/682059653698686977/photo/1",11,10,Tess,Other,2.0,Jigsaw_Puzzle,0.995873,False,1915.0,5442.0
682032003584274432,2015-12-30 02:54:35 +0000,"<a href=""http://twitter.com/download/iphone"" rel=""nofollow"">Twitter for iPhone</a>",This is Ulysses. He likes holding hands and his eyes are magic. 11/10 https://t.co/gPmJHmtgak,https://twitter.com/dog_rates/status/682032003584274432/photo/1,11,10,Ulysses,Other,1.0,Schipperke,0.997953,True,2294.0,7223.0
681694085539872773,2015-12-29 04:31:49 +0000,"<a href=""http://twitter.com/download/iphone"" rel=""nofollow"">Twitter for iPhone</a>",This is Bo. He's a Benedoop Cumbersnatch. Seems frustrated with own feet. Portable as hell. 11/10 very solid pupper https://t.co/TONMhRoQh7,https://twitter.com/dog_rates/status/681694085539872773/photo/1,11,10,Bo,pupper,1.0,Toy_Poodle,0.920992,True,4581.0,14010.0
681654059175129088,2015-12-29 01:52:46 +0000,"<a href=""http://twitter.com/download/iphone"" rel=""nofollow"">Twitter for iPhone</a>",This is Toffee. He's a happy pupper. Appears dangerously fluffy. Extraordinarily spherical. 12/10 would pet firmly https://t.co/oEXEKt3MHu,https://twitter.com/dog_rates/status/681654059175129088/photo/1,12,10,Toffee,pupper,1.0,Pomeranian,0.800538,True,1045.0,2903.0
681610798867845120,2015-12-28 23:00:52 +0000,"<a href=""http://twitter.com/download/iphone"" rel=""nofollow"">Twitter for iPhone</a>",*collapses* 12/10 https://t.co/C7M8mnzHIK,https://twitter.com/dog_rates/status/681610798867845120/photo/1,12,10,None,Other,1.0,Toy_Poodle,0.8217040000000001,True,533.0,2100.0
681579835668455424,2015-12-28 20:57:50 +0000,"<a href=""http://twitter.com/download/iphone"" rel=""nofollow"">Twitter for iPhone</a>",This is Apollo. He thought you weren't coming back so he had a mental breakdown. 8/10 we've all been there https://t.co/ojUBrDCHLT,https://twitter.com/dog_rates/status/681579835668455424/photo/1,8,10,Apollo,Other,1.0,Rottweiler,0.760671,True,1489.0,3893.0
681339448655802368,2015-12-28 05:02:37 +0000,"<a href=""http://twitter.com/download/iphone"" rel=""nofollow"">Twitter for iPhone</a>",This is Asher. He's not wearing a seatbelt or keeping both paws on the wheel. Absolute menace on the roadways. 9/10 https://t.co/V3SWuHACkh,https://twitter.com/dog_rates/status/681339448655802368/photo/1,9,10,Asher,Other,1.0,Seat_Belt,0.5324409999999999,False,4598.0,10202.0
681281657291280384,2015-12-28 01:12:59 +0000,"<a href=""http://twitter.com/download/iphone"" rel=""nofollow"">Twitter for iPhone</a>",Meet Sarge. His parents signed him up for dancing lessons but his true passion is roller coasters 11/10 very petable https://t.co/KvVoBIgkje,https://twitter.com/dog_rates/status/681281657291280384/photo/1,11,10,Sarge,Other,1.0,Saint_Bernard,0.99883,True,1258.0,3520.0
681193455364796417,2015-12-27 19:22:30 +0000,"<a href=""http://twitter.com/download/iphone"" rel=""nofollow"">Twitter for iPhone</a>",This is Aspen. He's astronomically fluffy. I wouldn't stop petting this dog if the world was ending around me 11/10 https://t.co/oBlgL9nxpx,"https://twitter.com/dog_rates/status/681193455364796417/photo/1,https://twitter.com/dog_rates/status/681193455364796417/photo/1",11,10,Aspen,Other,1.0,Pomeranian,0.992619,True,1691.0,4077.0
680970795137544192,2015-12-27 04:37:44 +0000,"<a href=""http://twitter.com/download/iphone"" rel=""nofollow"">Twitter for iPhone</a>",I thought I made this very clear. We only rate dogs. Stop sending other things like this shark. Thank you... 9/10 https://t.co/CXSJZ4Stk3,https://twitter.com/dog_rates/status/680970795137544192/photo/1,9,10,None,Other,1.0,Pug,0.713102,True,749.0,2665.0
680959110691590145,2015-12-27 03:51:18 +0000,"<a href=""http://twitter.com/download/iphone"" rel=""nofollow"">Twitter for iPhone</a>",This is Ozzie. He was doing fine until he lost traction in those festive socks. Now he's tired. 9/10 still killin it https://t.co/u4FYdIRKnY,"https://twitter.com/dog_rates/status/680959110691590145/photo/1,https://twitter.com/dog_rates/status/680959110691590145/photo/1,https://twitter.com/dog_rates/status/680959110691590145/photo/1",9,10,Ozzie,Other,2.0,Carousel,0.500992,False,2243.0,4986.0
680934982542561280,2015-12-27 02:15:25 +0000,"<a href=""http://twitter.com/download/iphone"" rel=""nofollow"">Twitter for iPhone</a>",Say hello to Sadie. She's a Tortellini Sidewinder. Very jubilant pup. Seems loyal. Leaves on point. 10/10 petable af https://t.co/g2bTu4ayPl,https://twitter.com/dog_rates/status/680934982542561280/photo/1,10,10,Sadie,Other,1.0,Labrador_Retriever,0.7843979999999999,True,497.0,2285.0
680913438424612864,2015-12-27 00:49:49 +0000,"<a href=""http://twitter.com/download/iphone"" rel=""nofollow"">Twitter for iPhone</a>",Meet Griswold. He's dapper as hell. Already pumped for next Christmas. 11/10 https://t.co/5NrpNDyFzN,https://twitter.com/dog_rates/status/680913438424612864/photo/1,11,10,Griswold,Other,1.0,Pomeranian,0.615678,True,705.0,2609.0
680889648562991104,2015-12-26 23:15:17 +0000,"<a href=""http://twitter.com/download/iphone"" rel=""nofollow"">Twitter for iPhone</a>",This is Cheesy. It's her birthday. She's patiently waiting to eat her party muffin. 9/10 happy birthday pup https://t.co/cH2H7mch2H,https://twitter.com/dog_rates/status/680889648562991104/photo/1,9,10,Cheesy,Other,1.0,Shetland_Sheepdog,0.876337,True,418.0,1945.0
680801747103793152,2015-12-26 17:25:59 +0000,"<a href=""http://twitter.com/download/iphone"" rel=""nofollow"">Twitter for iPhone</a>",Great picture here. Dog on the right panicked &amp; forgot about his tongue. Middle green dog must've fainted. All 10/10 https://t.co/31npKUAox0,https://twitter.com/dog_rates/status/680801747103793152/photo/1,10,10,None,Other,1.0,Pug,0.99672,True,925.0,2600.0
680609293079592961,2015-12-26 04:41:15 +0000,"<a href=""http://twitter.com/download/iphone"" rel=""nofollow"">Twitter for iPhone</a>",This is Brody. That is his chair. He loves his chair. Never leaves it. 9/10 might be stuck actually https://t.co/WvJRg0XJit,https://twitter.com/dog_rates/status/680609293079592961/photo/1,9,10,Brody,Other,1.0,French_Bulldog,0.700764,True,816.0,2906.0
680583894916304897,2015-12-26 03:00:19 +0000,"<a href=""http://twitter.com/download/iphone"" rel=""nofollow"">Twitter for iPhone</a>",This is Penny. Her tennis ball slowly rolled down her cone and into the pool. 8/10 bad things happen to good puppers https://t.co/YNWU7LeFgg,"https://twitter.com/dog_rates/status/680583894916304897/photo/1,https://twitter.com/dog_rates/status/680583894916304897/photo/1,https://twitter.com/dog_rates/status/680583894916304897/photo/1,https://twitter.com/dog_rates/status/680583894916304897/photo/1",8,10,Penny,Other,1.0,Tub,0.8898010000000001,False,1514.0,3939.0
680497766108381184,2015-12-25 21:18:05 +0000,"<a href=""http://twitter.com/download/iphone"" rel=""nofollow"">Twitter for iPhone</a>",Meet Percy. He's a Latvian Yuletide Heineken. Refuses to take off sweater. Kinda feisty. 12/10 would keep in pocket https://t.co/QGM5Fcuv7s,https://twitter.com/dog_rates/status/680497766108381184/photo/1,12,10,Percy,Other,1.0,Chihuahua,0.538354,True,2162.0,4639.0
680473011644985345,2015-12-25 19:39:43 +0000,"<a href=""http://twitter.com/download/iphone"" rel=""nofollow"">Twitter for iPhone</a>","This is Hector. He thinks he's a hammer. Silly Hector. You're a pupper, not a hammer. 10/10 https://t.co/OdUFuZIXiI",https://twitter.com/dog_rates/status/680473011644985345/photo/1,10,10,Hector,pupper,1.0,Lakeland_Terrier,0.796694,True,844.0,2778.0
680440374763077632,2015-12-25 17:30:01 +0000,"<a href=""http://twitter.com/download/iphone"" rel=""nofollow"">Twitter for iPhone</a>",Merry Christmas. My gift to you is this tiny unicorn running into a wall in slow motion. 11/10 https://t.co/UKqIAnR3He,https://twitter.com/dog_rates/status/680440374763077632/video/1,11,10,None,Other,1.0,Space_Heater,0.920367,False,564.0,1583.0
680191257256136705,2015-12-25 01:00:07 +0000,"<a href=""http://twitter.com/download/iphone"" rel=""nofollow"">Twitter for iPhone</a>",Here's a sleepy Christmas pupper 11/10 https://t.co/KXg0f8GNQ9,https://twitter.com/dog_rates/status/680191257256136705/photo/1,11,10,None,pupper,1.0,Brittany_Spaniel,0.7332529999999999,True,577.0,2356.0
680115823365742593,2015-12-24 20:00:22 +0000,"<a href=""http://twitter.com/download/iphone"" rel=""nofollow"">Twitter for iPhone</a>",This is Ozzy. He woke up 2 minutes before he had to be ready for the Christmas party. 9/10 classic Ozzy https://t.co/Kt9vmw0Fap,https://twitter.com/dog_rates/status/680115823365742593/photo/1,9,10,Ozzy,Other,1.0,Pug,0.999365,True,1028.0,2972.0
680100725817409536,2015-12-24 19:00:23 +0000,"<a href=""https://about.twitter.com/products/tweetdeck"" rel=""nofollow"">TweetDeck</a>",This pupper is not coming inside until she catches a snowflake on her tongue. 11/10 the determination is palpable https://t.co/lvMYbmKq8H,https://twitter.com/dog_rates/status/680100725817409536/photo/1,11,10,None,pupper,1.0,Golden_Retriever,0.6989609999999999,True,1554.0,3891.0
680085611152338944,2015-12-24 18:00:19 +0000,"<a href=""https://about.twitter.com/products/tweetdeck"" rel=""nofollow"">TweetDeck</a>",This is by far the most coordinated series of pictures I was sent. Downright impressive in every way. 12/10 for all https://t.co/etzLo3sdZE,"https://twitter.com/dog_rates/status/680085611152338944/photo/1,https://twitter.com/dog_rates/status/680085611152338944/photo/1,https://twitter.com/dog_rates/status/680085611152338944/photo/1",12,10,by,Other,3.0,Pillow,0.778113,False,10034.0,13959.0
680055455951884288,2015-12-24 16:00:30 +0000,"<a href=""https://about.twitter.com/products/tweetdeck"" rel=""nofollow"">TweetDeck</a>","Meet Sammy. At first I was like ""that's a snowflake. we only rate dogs,"" but he would've melted by now, so 10/10 https://t.co/MQfPK4zwuh",https://twitter.com/dog_rates/status/680055455951884288/photo/1,10,10,Sammy,Other,1.0,Samoyed,0.995466,True,8067.0,18278.0
679877062409191424,2015-12-24 04:11:37 +0000,"<a href=""http://twitter.com/download/iphone"" rel=""nofollow"">Twitter for iPhone</a>",Meet Penelope. She's a bacon frise. Total babe (lol get it like the movie). Doesn't bark tho. 5/10 very average dog https://t.co/SDcQYg0HSZ,https://twitter.com/dog_rates/status/679877062409191424/photo/1,5,10,Penelope,Other,1.0,Hog,0.809466,False,726.0,2155.0
679862121895714818,2015-12-24 03:12:15 +0000,"<a href=""http://twitter.com/download/iphone"" rel=""nofollow"">Twitter for iPhone</a>","""Dammit hooman I'm jus trynna lik the fler"" 11/10 https://t.co/eRZRI8OTj7",https://twitter.com/dog_rates/status/679862121895714818/photo/1,11,10,None,Other,1.0,Entlebucher,0.5232060000000001,True,706.0,2678.0
679854723806179328,2015-12-24 02:42:51 +0000,"<a href=""http://twitter.com/download/iphone"" rel=""nofollow"">Twitter for iPhone</a>",This is Bruce. He's a rare pup. Covered in Frosted Flakes. Nifty gold teeth. Overall good dog. 7/10 would pet firmly https://t.co/RtxxACzZ8A,https://twitter.com/dog_rates/status/679854723806179328/photo/1,7,10,Bruce,Other,1.0,Llama,0.887963,False,1402.0,3143.0
679844490799091713,2015-12-24 02:02:12 +0000,"<a href=""http://twitter.com/download/iphone"" rel=""nofollow"">Twitter for iPhone</a>",This is Willie. He's floating away and needs your assistance. Please someone help Willie. 10/10 https://t.co/MJqygWqt8X,https://twitter.com/dog_rates/status/679844490799091713/photo/1,10,10,Willie,Other,1.0,Airedale,0.903832,True,887.0,2593.0
679777920601223168,2015-12-23 21:37:40 +0000,"<a href=""http://twitter.com/download/iphone"" rel=""nofollow"">Twitter for iPhone</a>",This is Rinna. She's melting. 10/10 get inside pupper https://t.co/PA0czwucsb,https://twitter.com/dog_rates/status/679777920601223168/photo/1,10,10,Rinna,pupper,1.0,Bloodhound,0.5288189999999999,True,1281.0,3390.0
679530280114372609,None,None,None,None,None,10,None,Other,1.0,Dalmatian,0.750256,True,2347.0,5208.0
679511351870550016,2015-12-23 03:58:25 +0000,"<a href=""http://twitter.com/download/iphone"" rel=""nofollow"">Twitter for iPhone</a>",Say hello to William. He makes fun of others because he's terrified of his own deep-seated insecurities. 7/10 https://t.co/bwuV6FlRxr,https://twitter.com/dog_rates/status/679511351870550016/photo/1,7,10,William,Other,1.0,Chihuahua,0.761972,True,1461.0,3711.0
679503373272485890,2015-12-23 03:26:43 +0000,"<a href=""http://twitter.com/download/iphone"" rel=""nofollow"">Twitter for iPhone</a>",This is Dwight. He's a pointy pupper. Very docile. Attracts marshmallows. Hurts to pet but definitely worth it 8/10 https://t.co/jjW7zTxY9Z,https://twitter.com/dog_rates/status/679503373272485890/photo/1,8,10,Dwight,pupper,1.0,Porcupine,0.999846,False,1673.0,3484.0
679462823135686656,2015-12-23 00:45:35 +0000,"<a href=""http://twitter.com/download/iphone"" rel=""nofollow"">Twitter for iPhone</a>",Meet Hurley. He's the curly one. He hugs every other dog he sees during his walk. 11/10 for spreading the love https://t.co/M6vqkt2GKV,https://twitter.com/dog_rates/status/679462823135686656/photo/1,11,10,Hurley,Other,1.0,Toy_Poodle,0.62178,True,21324.0,34856.0
679062614270468097,2015-12-21 22:15:18 +0000,"<a href=""http://twitter.com/download/iphone"" rel=""nofollow"">Twitter for iPhone</a>",This is Chompsky. He lives up to his name. 11/10 https://t.co/Xl37lQEWd0,"https://twitter.com/dog_rates/status/679062614270468097/photo/1,https://twitter.com/dog_rates/status/679062614270468097/photo/1",11,10,Chompsky,Other,2.0,Cash_Machine,0.802333,False,9299.0,18712.0
679047485189439488,2015-12-21 21:15:11 +0000,"<a href=""http://twitter.com/download/iphone"" rel=""nofollow"">Twitter for iPhone</a>",This dog doesn't know how to stairs. Quite tragic really. 9/10 get it together pup https://t.co/kTpr9PTMg1,https://twitter.com/dog_rates/status/679047485189439488/photo/1,9,10,None,Other,1.0,Panpipe,0.962572,False,781.0,2460.0
678969228704284672,2015-12-21 16:04:13 +0000,"<a href=""http://twitter.com/download/iphone"" rel=""nofollow"">Twitter for iPhone</a>",Meet Lola. She's a Metamorphic Chartreuse. Plays with her food. Insubordinate and churlish. Exquisite hardwood 11/10 https://t.co/etpBNXwN7f,https://twitter.com/dog_rates/status/678969228704284672/photo/1,11,10,Lola,Other,1.0,Labrador_Retriever,0.680251,True,528.0,1796.0
678798276842360832,2015-12-21 04:44:55 +0000,"<a href=""http://twitter.com/download/iphone"" rel=""nofollow"">Twitter for iPhone</a>",This is Linda. She fucking hates trees. 7/10 https://t.co/blaY85FIxR,https://twitter.com/dog_rates/status/678798276842360832/photo/1,7,10,Linda,Other,1.0,Airedale,0.583122,True,1350.0,3804.0
678767140346941444,2015-12-21 02:41:11 +0000,"<a href=""http://twitter.com/download/iphone"" rel=""nofollow"">Twitter for iPhone</a>",This is Mia. She makes awful decisions. 8/10 https://t.co/G6TQVgTcZz,https://twitter.com/dog_rates/status/678767140346941444/photo/1,8,10,Mia,Other,1.0,Harp,0.8211200000000001,False,1553.0,3864.0
678764513869611008,2015-12-21 02:30:45 +0000,"<a href=""http://twitter.com/download/iphone"" rel=""nofollow"">Twitter for iPhone</a>","Meet Wilson. He got caught humping the futon. He's like ""dude, help me out here"" 10/10 I'd help Wilson out https://t.co/m6XoclB0qv",https://twitter.com/dog_rates/status/678764513869611008/photo/1,10,10,Wilson,Other,1.0,Irish_Terrier,0.696646,True,544.0,1788.0
678755239630127104,2015-12-21 01:53:54 +0000,"<a href=""http://twitter.com/download/iphone"" rel=""nofollow"">Twitter for iPhone</a>",This is Dash. He didn't think the water would be that cold. Damn it Dash it's December. Think a little. 10/10 https://t.co/NqcOwG8pxW,https://twitter.com/dog_rates/status/678755239630127104/photo/1,10,10,Dash,Other,1.0,Malamute,0.606654,True,3741.0,7802.0
678740035362037760,2015-12-21 00:53:29 +0000,"<a href=""http://twitter.com/download/iphone"" rel=""nofollow"">Twitter for iPhone</a>",Meet Tango. He's a large dog. Doesn't care much for personal space. Owner isn't very accepting. Tongue slip. 6/10 https://t.co/p2T5kGebxe,https://twitter.com/dog_rates/status/678740035362037760/photo/1,6,10,Tango,Other,1.0,Seat_Belt,0.7871640000000001,False,1926.0,4099.0
678424312106393600,2015-12-20 03:58:55 +0000,"<a href=""http://twitter.com/download/iphone"" rel=""nofollow"">Twitter for iPhone</a>",This is Crystal. She's a shitty fireman. No sense of urgency. People could be dying Crystal. 2/10 just irresponsible https://t.co/rtMtjSl9pz,https://twitter.com/dog_rates/status/678424312106393600/photo/1,2,10,Crystal,Other,1.0,Maltese_Dog,0.759945,True,2880.0,5916.0
678399652199309312,2015-12-20 02:20:55 +0000,"<a href=""http://twitter.com/download/iphone"" rel=""nofollow"">Twitter for iPhone</a>",This made my day. 12/10 please enjoy https://t.co/VRTbo3aAcm,https://twitter.com/dog_rates/status/678399652199309312/video/1,12,10,None,Other,1.0,Swing,0.929196,False,30742.0,61794.0
678396796259975168,2015-12-20 02:09:34 +0000,"<a href=""http://twitter.com/download/iphone"" rel=""nofollow"">Twitter for iPhone</a>",These little fellas have opposite facial expressions. Both 12/10 https://t.co/LmThv0GWen,"https://twitter.com/dog_rates/status/678396796259975168/photo/1,https://twitter.com/dog_rates/status/678396796259975168/photo/1",12,10,None,Other,2.0,Pembroke,0.95618,True,478.0,1731.0
678389028614488064,2015-12-20 01:38:42 +0000,"<a href=""http://twitter.com/download/iphone"" rel=""nofollow"">Twitter for iPhone</a>","This is Bella. She just learned that her final grade in chem was a 92.49 
poor pupper 11/10 https://t.co/auOoKuoveM",https://twitter.com/dog_rates/status/678389028614488064/photo/1,11,10,Bella,pupper,1.0,Miniature_Pinscher,0.516284,True,473.0,2044.0
678341075375947776,2015-12-19 22:28:09 +0000,"<a href=""http://twitter.com/download/iphone"" rel=""nofollow"">Twitter for iPhone</a>",This pupper likes tape. 12/10 https://t.co/cSp6w5GWgm,https://twitter.com/dog_rates/status/678341075375947776/photo/1,12,10,None,pupper,1.0,Golden_Retriever,0.853284,True,612.0,1896.0
678278586130948096,2015-12-19 18:19:51 +0000,"<a href=""http://twitter.com/download/iphone"" rel=""nofollow"">Twitter for iPhone</a>",Another spooky pupper here. Most definitely floating. No legs. Probably knows some dark magic. 10/10 very spooked https://t.co/JK8MByRzgj,https://twitter.com/dog_rates/status/678278586130948096/photo/1,10,10,None,pupper,1.0,Maltese_Dog,0.897841,True,6857.0,12531.0
678255464182861824,2015-12-19 16:47:58 +0000,"<a href=""http://twitter.com/download/iphone"" rel=""nofollow"">Twitter for iPhone</a>",This is Jessifer. She is a Bismoth Teriyaki. Flowers being attacked by hurricanes on bandana (rad). 9/10 stellar pup https://t.co/nZhmRwZzWv,https://twitter.com/dog_rates/status/678255464182861824/photo/1,9,10,Jessifer,Other,1.0,Chihuahua,0.613819,True,418.0,1726.0
678021115718029313,2015-12-19 01:16:45 +0000,"<a href=""http://twitter.com/download/iphone"" rel=""nofollow"">Twitter for iPhone</a>",This is Reese. He likes holding hands. 12/10 https://t.co/cbLroGCbmh,https://twitter.com/dog_rates/status/678021115718029313/photo/1,12,10,Reese,Other,1.0,Miniature_Pinscher,0.822048,True,7148.0,15018.0
677895101218201600,2015-12-18 16:56:01 +0000,"<a href=""http://twitter.com/download/iphone"" rel=""nofollow"">Twitter for iPhone</a>",Guys this was terrifying. Really spooked me up. We don't rate ghosts. We rate dogs. Please only send dogs... 9/10 https://t.co/EJImi1udYb,https://twitter.com/dog_rates/status/677895101218201600/photo/1,9,10,None,Other,1.0,Dalmatian,0.550702,True,2384.0,5275.0
677716515794329600,2015-12-18 05:06:23 +0000,"<a href=""http://twitter.com/download/iphone"" rel=""nofollow"">Twitter for iPhone</a>",IT'S PUPPERGEDDON. Total of 144/120 ...I think https://t.co/ZanVtAtvIq,https://twitter.com/dog_rates/status/677716515794329600/photo/1,144,10,None,Other,1.0,Teddy,0.6629079999999999,False,1104.0,3323.0
677698403548192770,2015-12-18 03:54:25 +0000,"<a href=""http://twitter.com/download/iphone"" rel=""nofollow"">Twitter for iPhone</a>",This is Sadie. She got her holidays confused. 9/10 damn it Sadie https://t.co/fm7HxOsuPK,https://twitter.com/dog_rates/status/677698403548192770/photo/1,9,10,Sadie,Other,1.0,Shih-Tzu,0.916645,True,363.0,1332.0
677687604918272002,2015-12-18 03:11:30 +0000,"<a href=""http://twitter.com/download/iphone"" rel=""nofollow"">Twitter for iPhone</a>",This was Cindy's face when she heard Susan forgot the snacks for after the kid's soccer game. 11/10 https://t.co/gzkuVGRgAD,https://twitter.com/dog_rates/status/677687604918272002/photo/1,11,10,None,Other,1.0,Pembroke,0.573047,True,950.0,2681.0
677673981332312066,2015-12-18 02:17:22 +0000,"<a href=""http://twitter.com/download/iphone"" rel=""nofollow"">Twitter for iPhone</a>",Endangered triangular pup here. Could be a wizard. Caught mid-laugh. No legs. Just fluff. Probably a wizard. 9/10 https://t.co/GFVIHIod0Z,https://twitter.com/dog_rates/status/677673981332312066/photo/1,9,10,None,Other,1.0,Maltese_Dog,0.817908,True,1677.0,3603.0
677644091929329666,None,None,None,None,None,10,None,Other,1.0,Chihuahua,0.626236,True,886.0,2040.0
677573743309385728,2015-12-17 19:39:03 +0000,"<a href=""http://twitter.com/download/iphone"" rel=""nofollow"">Twitter for iPhone</a>",This is Sandy. He's sexually confused. Thinks he's a pigeon. Also an All-American cheese catcher. 10/10 so petable https://t.co/Htu8plSqEu,"https://twitter.com/dog_rates/status/677573743309385728/photo/1,https://twitter.com/dog_rates/status/677573743309385728/photo/1",10,10,Sandy,Other,2.0,Patio,0.5350699999999999,False,819.0,2322.0
